<?xml version="1.0" encoding="UTF-8"?>
<tns:garden xmlns:tns="http://www.example.org/garden"
	xmlns:xsi="http://www.w3.org/2001/XMLSchema-instance"
	xsi:schemaLocation="http://www.example.org/garden plants.xsd ">
	<tns:tree>
		<tns:name>Apple</tns:name>
		<tns:height>2.0</tns:height>
		<tns:group>FRUIT</tns:group>
		<tns:diameter>5</tns:diameter>
	</tns:tree>
	<tns:tree>
		<tns:name>Cherry</tns:name>
		<tns:height>2.0</tns:height>
		<tns:group>FRUIT</tns:group>
		<tns:diameter>6</tns:diameter>
	</tns:tree>
	<tns:tree>
		<tns:name>Pear</tns:name>
		<tns:height>2.0</tns:height>
		<tns:group>FRUIT</tns:group>
		<tns:diameter>7</tns:diameter>
	</tns:tree>
	<tns:bush>
		<tns:name>Plum</tns:name>
		<tns:height>1.0</tns:height>
		<tns:group>FRUIT</tns:group>
		<tns:stem>3</tns:stem>
	</tns:bush>
	<tns:bush>
		<tns:name>Raspberry</tns:name>
		<tns:height>1.0</tns:height>
		<tns:group>BERRY</tns:group>
		<tns:stem>7</tns:stem>
	</tns:bush>
</tns:garden>
